{
  "schema_version": 1,
  "issue": 193,
  "gui_status": "quick-admitted",
  "shell_surface": "LoopEditor",
  "ui_foundation": {
    "candidate": "Qt Quick Controls",
    "decision_issue": 178,
    "decision_status": "accepted-with-admission-gates"
  },
  "workspaces": [
    {
      "id": "document",
      "manifest_surface": "loop-document",
      "preserves": [
        "document",
        "preflight"
      ]
    },
    {
      "id": "preflight",
      "manifest_surface": "loop-preflight",
      "preserves": [
        "document",
        "preflight"
      ]
    },
    {
      "id": "production-preview",
      "manifest_surface": "loop-production-preview",
      "preserves": [
        "document",
        "preflight"
      ]
    },
    {
      "id": "pages",
      "manifest_surface": "loop-pages-production",
      "preserves": [
        "document",
        "preflight"
      ]
    },
    {
      "id": "inspect",
      "manifest_surface": "loop-inspect",
      "preserves": [
        "document",
        "preflight"
      ]
    },
    {
      "id": "fix",
      "manifest_surface": "loop-fix",
      "preserves": [
        "document",
        "preflight"
      ]
    },
    {
      "id": "compare",
      "manifest_surface": "loop-compare",
      "preserves": [
        "document",
        "preflight"
      ]
    }
  ],
  "state_invariants": [
    "A workspace switch changes visible context only; it never closes the document.",
    "A workspace switch never discards a preflight report or changes its bound document revision.",
    "Document state, production state, and preflight state remain separate and inspectable.",
    "The shell owns navigation and context selection; Core and PdfTool remain the semantic owners of PDF operations.",
    "Compare is presented by the LoopEditor Quick shell over Core comparison facts (repair diff and finding delta); the LoopDiff executable absorption remains an OPEN product decision tracked by docs/product-surface.json.",
    "A missing action disposition blocks shell integration instead of inventing a default route."
  ],
  "status_contract": {
    "document": [
      "NO_DOCUMENT",
      "OPEN",
      "MODIFIED",
      "OUTPUT_PENDING",
      "OUTPUT_SAVED"
    ],
    "production": [
      "NOT_READY",
      "READY",
      "OPERATION_PENDING",
      "APPROVAL_REQUIRED",
      "OUTPUT_WRITTEN"
    ],
    "preflight": [
      "NOT_CHECKED",
      "RUNNING",
      "CANCELLED",
      "PASS",
      "FINDINGS",
      "STALE",
      "INCOMPLETE"
    ]
  },
  "action_policy": "docs/loop-shell-actions.json",
  "plugin_action_policy": [
    {
      "plugin": "DimensionsPlugin",
      "disposition": "ABSORB",
      "target": "Inspect",
      "owner": "m.berry",
      "replacement_target": "loop-inspect",
      "required_test": "UnitTests/tst_p4s9interaction.cpp",
      "evidence_artifact": "docs/loop-shell.json",
      "deletion_condition": "Deleted in Phase 5 Issue 17; Quick workspace Inspect owns capability via loop-inspect.",
      "follow_up_issue": 193
    },
    {
      "plugin": "ObjectInspectorPlugin",
      "disposition": "ADVANCED",
      "target": "Inspect",
      "owner": "m.berry",
      "replacement_target": "loop-inspect",
      "required_test": "UnitTests/tst_p4s9interaction.cpp",
      "evidence_artifact": "docs/loop-shell.json",
      "deletion_condition": "Deleted in Phase 5 Issue 17; Quick workspace Inspect owns capability via loop-inspect.",
      "follow_up_issue": 193
    },
    {
      "plugin": "OutputPreviewPlugin",
      "disposition": "ABSORB",
      "target": "Production",
      "owner": "m.berry",
      "replacement_target": "loop-production-preview",
      "required_test": "UnitTests/tst_p4s9interaction.cpp",
      "evidence_artifact": "docs/loop-shell.json",
      "deletion_condition": "Deleted in Phase 5 Issue 17; Quick workspace Production owns capability via loop-production-preview.",
      "follow_up_issue": 193
    },
    {
      "plugin": "SoftProofingPlugin",
      "disposition": "ABSORB",
      "target": "Production",
      "owner": "m.berry",
      "replacement_target": "loop-production-preview",
      "required_test": "UnitTests/tst_p4s9interaction.cpp",
      "evidence_artifact": "docs/loop-shell.json",
      "deletion_condition": "Deleted in Phase 5 Issue 17; Quick workspace Production owns capability via loop-production-preview.",
      "follow_up_issue": 193
    },
    {
      "plugin": "RedactPlugin",
      "disposition": "OPEN",
      "target": "Fix",
      "owner": "m.berry",
      "replacement_target": "loop-fix",
      "required_test": "UnitTests/tst_p4s9interaction.cpp",
      "evidence_artifact": "docs/loop-shell.json",
      "deletion_condition": "Deleted in Phase 5 Issue 17; Quick workspace Fix owns capability via loop-fix. Product decision remains OPEN on issue #66.",
      "follow_up_issue": 66
    },
    {
      "plugin": "SignaturePlugin",
      "disposition": "ADVANCED",
      "target": "Inspect",
      "owner": "m.berry",
      "replacement_target": "loop-inspect",
      "required_test": "UnitTests/tst_p4s9interaction.cpp",
      "evidence_artifact": "docs/loop-shell.json",
      "deletion_condition": "Deleted in Phase 5 Issue 17; Quick workspace Inspect owns capability via loop-inspect."
    },
    {
      "plugin": "EditorPlugin",
      "disposition": "ABSORB",
      "target": "Document",
      "owner": "m.berry",
      "replacement_target": "loop-document",
      "required_test": "UnitTests/tst_editorhosttest.cpp",
      "evidence_artifact": "docs/loop-shell.json",
      "deletion_condition": "Deleted in Phase 5 Issue 17; Quick workspace Document owns capability via loop-document.",
      "follow_up_issue": 193
    },
    {
      "plugin": "LoopPreflightPlugin",
      "disposition": "ABSORB",
      "target": "Preflight",
      "owner": "m.berry",
      "replacement_target": "loop-preflight",
      "required_test": "UnitTests/tst_p4s9interaction.cpp",
      "evidence_artifact": "docs/loop-shell.json",
      "deletion_condition": "Deleted in Phase 5 Issue 17; Quick workspace Preflight owns capability via loop-preflight.",
      "follow_up_issue": 195
    },
    {
      "plugin": "ScannerPlugin",
      "disposition": "ADVANCED",
      "target": "Document",
      "owner": "m.berry",
      "replacement_target": "loop-document",
      "required_test": "UnitTests/tst_editorhosttest.cpp",
      "evidence_artifact": "docs/loop-shell.json",
      "deletion_condition": "Deleted in Phase 5 Issue 17; Quick workspace Document owns capability via loop-document."
    },
    {
      "plugin": "AudioBookPlugin",
      "disposition": "STOP-SHIPPING",
      "target": "Advanced",
      "owner": "m.berry",
      "replacement_target": null,
      "required_test": "scripts/verify-loop-shell-contract.ps1",
      "evidence_artifact": "docs/loop-shell.json",
      "deletion_condition": "Deleted in Phase 5 Issue 17; STOP-SHIPPING. LoopEditor is the sole interactive product."
    },
    {
      "plugin": "OcrPlugin",
      "disposition": "STOP-SHIPPING",
      "target": "Advanced",
      "owner": "m.berry",
      "replacement_target": "loop-cli",
      "required_test": "PdfTool capabilities --console-format json",
      "evidence_artifact": "docs/loop-shell.json",
      "deletion_condition": "Deleted in Phase 5 Issue 17; loop-cli owns OCR. Plugin is absent from the loop-release install graph.",
      "follow_up_issue": 41
    },
    {
      "plugin": "ActionListPlugin",
      "disposition": "ABSORB",
      "target": "Fix",
      "owner": "m.berry",
      "replacement_target": "loop-fix",
      "required_test": "UnitTests/tst_editorhosttest.cpp",
      "evidence_artifact": "docs/loop-shell.json",
      "deletion_condition": "Deleted in Phase 5 Issue 17; Quick workspace Fix owns capability via loop-fix.",
      "follow_up_issue": 30
    }
  ],
  "legacy_surface_disposition": [
    {
      "path": "tools/CodeGenerator/generatormainwindow.ui",
      "disposition": "HEADLESS",
      "owner": "m.berry",
      "replacement_target": "loop-cli",
      "required_test": "scripts/verify-loop-shell-contract.ps1",
      "evidence_artifact": "docs/loop-shell.json",
      "deletion_condition": "Terminal: retained HEADLESS developer form; absent from loop-release install graph.",
      "rationale": "Developer fixture generator; not a product surface."
    },
    {
      "path": "tools/JBIG2_Viewer/mainwindow.ui",
      "disposition": "HEADLESS",
      "owner": "m.berry",
      "replacement_target": "loop-inspect",
      "required_test": "scripts/verify-loop-shell-contract.ps1",
      "evidence_artifact": "docs/loop-shell.json",
      "deletion_condition": "Terminal: retained HEADLESS developer form; absent from loop-release install graph.",
      "rationale": "Developer JBIG2 probe; not a product surface."
    }
  ]
}
